{
  "container" : {
    "containerVolume" : 20000,
    "containerDescription" : "Abrollcontainer (ARC)",
    "containerWeight" : 3000.0,
    "containerTypeId" : "AB.1.16.20000.A6B3C4D0E0F0F0H1I0J0K0L1.AR20-234"
  },
  "receiver" : {
    "bpnsProperty" : "BPNS0123456789ZZ",
    "actorNumber" : "ENR-ERZ-3456",
    "actorRole" : "Dismantling Facility"
  },
  "sender" : {
    "bpnsProperty" : "BPNS0123456789ZZ",
    "actorNumber" : "ENR-ERZ-3456",
    "actorRole" : "Dismantling Facility"
  },
  "childProcessSteps" : [ {
    "weighingSlip" : "document122345",
    "lossType" : "Abrasion",
    "measurementTimestamp" : "2024-01-01T14:23:00+01:00",
    "childProcessType" : "Removal of components",
    "outputNetMass" : 9.5,
    "measurementType" : "material scale",
    "processLoss" : 0.5,
    "endTimestamp" : "2024-01-01T14:23:00+01:00",
    "startTimestamp" : "2024-01-01T14:23:00+01:00",
    "inputNetMass" : 10.0
  } ],
  "processInformation" : {
    "processType" : "Dismantling",
    "chemicalRecycling" : false,
    "mechanicalRecycling" : true,
    "treatmentProcedure" : "R1"
  },
  "globalAssetId" : "7bF0adeB-ae6a-94bA-0cED-C5E520E8abD2",
  "recyclingBatchId" : "BATCH-0001-9999-abcd",
  "operator" : {
    "transferId" : "TRF-2025-1001",
    "bpnsProperty" : "BPNS0123456789ZZ"
  }
}